{
  "version": 1,
  "id": "formal-blind-v2-protocol-v2",
  "status": "frozen",
  "report_mode": "aggregate",
  "normalization_id": "zhtw-exact-v1",
  "one_shot": true,
  "detailed_rows_read": false,
  "files": {
    "benchmarks/accuracy/blind-v2.evaluation-ledger-event.schema.json": "99babffabe88a0dbfabd2e7333da8c6e9e6629e9f2a9356995ca6a92698508fe",
    "benchmarks/accuracy/formal-protocol.schema.json": "f0a7d7cac42a531bd0a20e7cd75efd38d5c0d0031d1f0d745974a4600eb6fa47",
    "benchmarks/accuracy/manifest.schema.json": "bd72be3388743e590ddc7379a44933512704f97d96706e4599f9caf52155cb8f",
    "benchmarks/accuracy/preregistration.schema.json": "77851119e43dd8b953e84da92c4fac831d3af324e9d92fd10a6f30c4a29ec9ca",
    "benchmarks/accuracy/ranking-policy-v1.json": "f3f36a289e79ba7f50b15bc99985bffbac9a354483172292ed99839fafbc8e19",
    "scripts/benchmark_metrics.py": "72a4acb912bec8e81f2756b688d17f50edb84e77e41a144c071bee4ccb23d64a",
    "scripts/blind_v2_governance.py": "b5424c8aa38784431179dc9f6c0d05f0589fc06c1bf1bb938b8e82a399f5053e",
    "scripts/competitor_benchmark.py": "c498eb8a52cedde16422c361b6cfa54ea55fe1969ae3d9f93a7ba1841174881d",
    "scripts/container_competitors.py": "59cf59f5e8f55ae11db98ea523522a78b2fea706f26cce3edf9e62b8c8c48ede",
    "scripts/run_accuracy_benchmark.py": "2798414ab5dfa2cbf3752a7ab4e688bc00569a7d04d99e05f59c0c5621daa3ef",
    "scripts/validate_benchmark_assets.py": "0c7363d8551d102d2b6f6749d0198c05d4d40daf9297661c134c3078d40f016f",
    "scripts/validate_competitor_environment.py": "78452da436491ec936d5cef4bebc5f2365ec17c00efe136492b9f9c39c0a6a8b"
  }
}
